questionid,original,v1,v2,v3,v4,v5
Q1,"Literature on Cardiac amyloidosis.  Please let me know where I can get literature on Cardiac amyloidosis.  My uncle died yesterday from this disorder.  Since this is such a rare disorder, and to honor his memory, I would like to distribute literature at his funeral service.  I am a retired NIH employee, so I am familiar with the campus in case you have literature at NIH that I can come and pick up.  Thank you ","I'm looking for literature on Cardiac amyloidosis, can you help me find some?","Where can I access literature on Cardiac amyloidosis, a rare disorder that recently claimed the life of my uncle?","As a retired NIH employee, I'm searching for literature on Cardiac amyloidosis to distribute at my uncle's funeral service, can you assist me?","In memory of my uncle who passed away from Cardiac amyloidosis, I'd like to share literature on this rare disorder at his funeral - can you point me in the right direction?","I'm trying to find literature on Cardiac amyloidosis to honor my uncle who recently passed away from this condition - are there any resources available, perhaps at NIH?"
Q2,"Migraine seems to be a spectrum of conditions rather than only one easily diagnosed affliction.  Many innovative migraine treatments are now in use, but it seems that each treatment only addresses a narrow set of conditions; for example, my daughter has tried many different treatment options (QEEG, HEG, TMS, topamax, ...) without success.  Has any research been done to characterize which treatment types are effective against which migraine types?",Are there any studies that have investigated the effectiveness of different migraine treatments for specific migraine types?,What research has been conducted to identify which migraine treatments are most effective for particular migraine conditions?,Have researchers attempted to categorize migraine treatments by their efficacy in addressing specific types of migraines?,Is there any scientific evidence that links specific migraine treatments to their effectiveness in treating certain migraine subtypes?,Have any studies been published that examine the correlation between migraine treatment types and their success rates in alleviating specific migraine conditions?
Q3,DO I USE PYRIDOXINE TABLETS EVEN IF IM PREGNANT?,Should I take pyridoxine tablets during pregnancy?,Are pyridoxine tablets safe to use when pregnant?,Can I continue using pyridoxine tablets while pregnant?,Is it okay to use pyridoxine tablets when I'm pregnant?,Do pyridoxine tablets have any restrictions for pregnant women?
Q4,i have lymphoma what causes cramp after chemo treatment,What triggers cramping after chemotherapy treatment in lymphoma patients?,Are muscle cramps a common side effect of chemotherapy for lymphoma?,Why do I experience cramping after undergoing chemotherapy for lymphoma?,What is the reason behind post-chemotherapy cramping in individuals with lymphoma?,"Can chemotherapy treatment for lymphoma cause muscle cramps, and if so, why?"
Q5,I wonder of new research and testing on macular degeneration and the opportunity to be part of this process.,Are there any opportunities to participate in new research and testing for macular degeneration?,"What are the latest developments in macular degeneration research and testing, and can I be involved?",Can I be a part of the new research and testing being conducted on macular degeneration?,Are there any chances to contribute to the research and testing of macular degeneration?,What opportunities exist for individuals to participate in macular degeneration research and testing?
Q6,Can you please send me as much information as possible on &quot;hypothyroidism&quot;. I was recently diagnosed with the disease and I am struggling to figure out what it is and how I got it. My name and address is: [NAME] [LOCATION] [CONTACT] Thank you in advance for your help!!!,I've recently been diagnosed with hypothyroidism and I'm struggling to understand what it is and how I contracted it - can you please provide me with as much information as possible?,"What information can you provide about hypothyroidism, as I've recently been diagnosed and I'm having trouble grasping the basics of the disease?",I've been diagnosed with hypothyroidism and I'm having trouble understanding the condition - can you send me detailed information on what it is and how it's acquired?,"I've recently received a diagnosis of hypothyroidism, but I'm unclear on the specifics - can you please send me as much information as you can on the disease?","Having recently been diagnosed with hypothyroidism, I'm seeking as much information as possible on the condition - can you please provide me with details on what it is and how it's caused?"
Q7,"A street dog bit me five years ago, I take all the vaccine from very next day from biting, now on that spot where bite there was etching problem since few day, please guide me is there any problem will create in future if create is there any treatment for rabies.","I was bitten by a street dog five years ago, and I received all the necessary vaccinations immediately after the incident; however, I've been experiencing etching problems on the bite spot for a few days now - should I be concerned about any potential future complications, and are there any treatments available for rabies?","Five years ago, I was bitten by a stray dog, and I got vaccinated right away; lately, I've noticed etching issues on the affected area - could this lead to any future problems, and what are the treatment options for rabies?","I got bitten by a dog on the street five years back, and I took all the required vaccine doses starting from the next day; now, I'm experiencing etching problems on the bite site - is there a risk of future complications, and are there any treatments available to combat rabies?","After being bitten by a street dog five years ago, I received all the necessary vaccinations from the very next day; currently, I'm dealing with etching issues on the affected area - should I worry about potential future problems, and what are the treatment options for rabies?","Five years ago, a street dog bit me, and I got vaccinated immediately; recently, I've developed etching problems on the bite site - are there any potential future risks, and what treatments are available for rabies?"
Q8,"Dear Sir/Madam  I'm [NAME] from [LOCATION], I'm 35 years old , I'd like to ask you a Medical Question as I've got an optic nerve atrophy in my eye and i lost my vision since i was 8 years old , Now I've got one eye just ,  So please is there treatment for optic nerve atrophy !  Please see the attachment which is a Medical report from [LOCATION],  Best Wishes  [NAME] ","I'm [NAME] from [LOCATION], 35 years old, and I've been living with optic nerve atrophy in one eye since I was 8 years old, resulting in vision loss; is there a treatment available for this condition?","I'm reaching out from [LOCATION] as a 35-year-old individual who has been dealing with optic nerve atrophy in my eye since childhood, leading to vision loss; can you inform me about potential treatments for this condition?","As a 35-year-old from [LOCATION] who has been affected by optic nerve atrophy since the age of 8, resulting in vision loss in one eye, I'm seeking information on possible treatments for this condition; can you help?","I'm [NAME], a 35-year-old from [LOCATION] who has been living with optic nerve atrophy since I was 8, which has caused me to lose my vision; are there any treatments available for optic nerve atrophy that could help me?","I'm writing to inquire about potential treatments for optic nerve atrophy, a condition I've been living with since I was 8 years old, which has resulted in vision loss in one eye; I've attached a medical report from [LOCATION] for your reference."
Q9,When and how do you know when you have congenital night blindness?,"How do you determine if you have congenital night blindness, and at what point do you realize it?","At what age or stage do you typically discover you have congenital night blindness, and what are the signs?","What are the indications that you have congenital night blindness, and when do they usually become apparent?","How can you identify congenital night blindness, and what is the typical timeline for diagnosis?","What are the symptoms and signs that indicate congenital night blindness, and when do they usually manifest?"
Q10,"Would appreciate any good info on Lewy Body Dementia, we need to get people aware of this dreadful disease, all they talk about is alzheimers.  Thank you ","Can you provide some information about Lewy Body Dementia, as it's often overshadowed by Alzheimer's?","What do you know about Lewy Body Dementia, a disease that deserves more attention than it gets, especially compared to Alzheimer's?","Is there a way to raise awareness about Lewy Body Dementia, a condition that is often eclipsed by discussions of Alzheimer's?","Do you have any insights or resources about Lewy Body Dementia, a disease that seems to be neglected in favor of Alzheimer's?","How can we educate people about Lewy Body Dementia, a serious condition that is frequently overshadowed by the focus on Alzheimer's?"
Q11,Gene changes or chromosomal changes of MSUD? What is the technical and simple language of MSUD? Are there any treatments for MSUD?,What are the genetic and chromosomal alterations associated with MSUD? Can you explain MSUD in simple and technical terms? Are there any available treatments for MSUD?,How do genetic mutations and chromosomal abnormalities contribute to MSUD? What are the technical and simple definitions of MSUD? Do any treatments exist for MSUD?,What genetic and chromosomal changes are characteristic of MSUD? Can you define MSUD in both technical and simple language? Are there any therapeutic options for MSUD?,What are the chromosomal and genetic changes that occur in individuals with MSUD? How would you describe MSUD in simple and technical terms? Are treatments available for individuals with MSUD?,What genetic mutations and chromosomal alterations are hallmarks of MSUD? Can you provide both technical and simple explanations of MSUD? Do any effective treatments exist for MSUD?
Q12,"I need to know if CDH can be passed down to future generations.  I just learned that this condition most likely caused the death of my first child back in 1971.  I was then told it was merely a fluke.  I had NO trauma during the full-term pregnancy, and I and my then husband were in very good health.  Now my son (from a different husband) and his wife are due to have fraternal twins in [DATE] 2015.  Does the term 'congenital' mean that it could be passed down to another generation?  I do not want to alarm my son and his wife.  I just would like to inform whatever pediatrician is caring for these babies as to my experience.  Unfortunately my son and I are estranged.  And I do not know who is their pediatrician.  My child's CDH was very severe.  I know there are far less severe cases that can go undetected &/or undiagnosed unless there is a reason to suspect such a condition.  Please respond to my concerns.","Can CDH be inherited by future generations, and does the term 'congenital' imply a risk of passing it down?",I'm concerned about the risk of CDH being passed down to my grandchildren; does the congenital nature of the condition mean it could affect future generations?,"After experiencing a severe case of CDH with my first child, I'm worried about the potential for it to be inherited by my grandchildren; can you provide guidance on the likelihood of this occurring?","I've recently learned that CDH may have caused the death of my first child, and I'm anxious to know if it can be passed down to future generations; what does the term 'congenital' mean in this context?","As a parent who has experienced a severe case of CDH, I'm seeking information on the risk of it being inherited by my grandchildren; can you clarify the implications of the term 'congenital' in relation to CDH?"
Q13,"sir,my friend is suffering from thalassemia ,in that majorly red blood anemia,white blood anemia and the blood is comming out from mouth when she got cough .her condition is very severe .in her body the red ,white blood cells are abscent .so that blood transfusion is doing for every 16-20days.then in the recent days the blood also comming out from mouth please tell me where can i get the treatment for this disease .we can travel around the world for treatment please reply me as soon as possible. thank you sir.","My friend has thalassemia, which is causing severe anemia and bleeding from the mouth when she coughs. Her body lacks red and white blood cells, requiring frequent blood transfusions every 16-20 days. Can you recommend a treatment center for this condition, as we're willing to travel anywhere in the world?","I have a friend suffering from thalassemia, which is characterized by a severe lack of red and white blood cells, leading to anemia and mouth bleeding when coughing. She requires blood transfusions every 16-20 days. Where can we find effective treatment for this condition, as we're open to traveling globally?","My friend is severely affected by thalassemia, resulting in anemia, mouth bleeding when coughing, and a complete absence of red and white blood cells. She needs blood transfusions every 16-20 days. Can you suggest a reliable treatment center for this disease, as we're willing to travel worldwide?","I'm concerned about my friend who has thalassemia, a condition causing severe anemia, mouth bleeding when coughing, and a complete lack of red and white blood cells. She requires frequent blood transfusions every 16-20 days. Where can we find the best treatment for this condition, as we're open to international travel?","My friend is battling severe thalassemia, which is causing anemia, mouth bleeding when coughing, and a complete deficiency of red and white blood cells. She needs regular blood transfusions every 16-20 days. Can you recommend a top-notch treatment center for this disease, as we're willing to travel anywhere in the world for effective care?"
Q14,"What can I give my [AGE] father to help him sleep? He said he will take whatever. He is not on any medication, not allergic to anything.  Fully ambilatory!","What gift can I give to my [AGE] father to help him with sleep, considering he's open to trying anything and has no medication or allergies to worry about?",My [AGE] father is having trouble sleeping and is willing to try anything; what natural remedies or products can I offer him to help?,"What are some potential sleep aids that I can give to my [AGE] father, given that he's not on any medication and has no allergies?","How can I help my fully ambulatory [AGE] father get a good night's sleep, and what options can I present to him since he's open to trying anything?","What sleep-promoting items or supplements can I consider giving to my [AGE] father, since he's not taking any medication and has no allergies to contend with?"
Q15,I was born with Diabetes Insipidus and have many problems since the cell was removed when I was 22 and ALL,I was born with Diabetes Insipidus and have experienced numerous difficulties since the removal of the cell at age 22; what could be the cause of ALL?,"Since having my cell removed at 22, I've faced many challenges due to being born with Diabetes Insipidus; can you explain why I have ALL?","Born with Diabetes Insipidus, I've encountered a multitude of issues following the removal of the cell at 22, including ALL; what's the connection?","Having been born with Diabetes Insipidus, I've struggled with various problems, particularly after the cell was removed at 22, and now I have ALL; what's going on?","I've had Diabetes Insipidus since birth and have experienced a range of difficulties, including ALL, since the cell was removed when I was 22; what's the underlying reason?"
Q16,I may have a couple anal fissures and looking to speak with someone to get some information and support.,I'm concerned I might have anal fissures and would like to discuss my situation with someone to get guidance and reassurance.,Are there any resources or individuals I can reach out to for information and emotional support regarding anal fissures?,"I'm seeking advice and a listening ear from someone knowledgeable about anal fissures, as I think I might be experiencing some symptoms.",Can someone provide me with information and support if I'm dealing with anal fissures?,Who can I talk to about getting help and guidance for possible anal fissures?
Q17,"Hello, my dad, 68 years old, has gastritis,  it did ache occasionally over the last several years. The other day, he went to hospital to have medical check-up with endoscopic ultrasonography, and found GIST with about 1cm in size. Doctor told him that he may consider surgery or not, it is up to him. What are we supposed to do? will it develop to bad condition? any suggestions?  I 'm looking forward to your early reply. Thank you so much.","My dad, 68, has gastritis and occasional stomach aches over the past few years. Recently, he had an endoscopic ultrasonography at the hospital and was diagnosed with a 1cm GIST. The doctor said surgery is optional. What's the next step?","My 68-year-old dad has been experiencing gastritis symptoms, including occasional stomach pain, for several years. He recently underwent an endoscopic ultrasonography at the hospital, which revealed a 1cm GIST. The doctor has left the decision to undergo surgery up to him. What should we do?","My father, 68, has had gastritis with intermittent stomach aches for the past few years. After a recent hospital visit, including an endoscopic ultrasonography, he was diagnosed with a 1cm GIST. The doctor presented surgery as an option, but left the decision to him. What's the best course of action?","I'm seeking advice for my 68-year-old dad, who has gastritis and has experienced occasional stomach pain over the past few years. He recently had an endoscopic ultrasonography at the hospital, which detected a 1cm GIST. The doctor has given him the option to undergo surgery or not. What are our options?","My dad, 68, has been dealing with gastritis and occasional stomach aches for several years. Following a recent hospital visit, including an endoscopic ultrasonography, he was diagnosed with a 1cm GIST. The doctor has left it up to him to decide whether or not to have surgery. What's the prognosis if we don't opt for surgery, and are there any other treatment options?"
Q18,"I have been diagnosed with SCA3. I was wondering if MedlinePlus is able to help me with resources that I may need on my journey through this disease? If not, can you help me find an organization or association that can help me.",I've been diagnosed with SCA3 and I'm looking for resources to help me navigate this disease - can MedlinePlus assist me?,Are there any resources on MedlinePlus that can support me through my SCA3 diagnosis?,"Following my SCA3 diagnosis, I'm seeking resources and guidance - can MedlinePlus provide me with the help I need?","As someone with SCA3, I'm trying to find reliable resources - does MedlinePlus offer any assistance or should I look elsewhere?","Now that I've been diagnosed with SCA3, I need help finding resources and support - can MedlinePlus or another organization provide me with what I need?"
Q19,how do I get help with my migraines a have bad cluster migraines.,What can I do to get relief from my cluster migraines?,How can I find support for managing my bad cluster migraines?,What are some ways to get assistance with my severe cluster migraines?,Are there any resources available to help me cope with my cluster migraines?,What steps can I take to get help with my debilitating cluster migraines?
Q20,know more of Congenital Heart Disease,Can you tell me more about Congenital Heart Disease?,What do you know about Congenital Heart Disease?,,,
Q21,Are there any researches indicating how early an individual may experience any signs or symptoms of Rheumatoid Arthritis?,Do any studies suggest when individuals may first experience signs or symptoms of Rheumatoid Arthritis?,"What is the earliest point at which a person may exhibit signs or symptoms of Rheumatoid Arthritis, according to research?",Are there any scientific investigations that identify when people may initially display symptoms of Rheumatoid Arthritis?,Can research provide insight into how early signs or symptoms of Rheumatoid Arthritis may appear in an individual?,What do studies reveal about the timing of the first signs or symptoms of Rheumatoid Arthritis in individuals?
Q22,"Genetic testing.  My mother in law is in the last stage if lung cancer and only has days to live.  My question is...testing her and comparing her tests with my husbands and his sisters test help to determine if it is genetic?  My mother in law ([NAME]) and her mother and her mithers sister both had lung cancer and none if them were smokers.  I'm real worried about my husband getting lung cancer now and I want find out what we can do to protect him.Thank you,[NAME] ","Can genetic testing of my terminally ill mother-in-law, and comparing her results with those of my husband and his sisters, help determine if lung cancer runs in the family?","Would genetic testing of my mother-in-law, who has a family history of lung cancer, and comparing her results with those of her relatives, help identify a potential genetic link?",Is it possible to use genetic testing to compare my mother-in-law's DNA with that of her children and siblings to determine if there's a genetic predisposition to lung cancer?,"Can a genetic test of my mother-in-law, who has lung cancer and a family history of the disease, help us understand if it's genetic and what steps we can take to protect my husband?","Would genetic testing of my mother-in-law, who is in the final stages of lung cancer, and comparing her results with those of her relatives, provide insight into whether the disease is hereditary and how to reduce my husband's risk?"
Q23,"If oleandor was ingested by touching the plant stems inner part and then directly eating without washing hands, how long would u exspect symptoms would start? And how severe would you say symptoms may get.","If you ingest oleandor by touching the inner part of the plant stems and then eat without washing your hands, how long would you expect symptoms to start, and how severe would the symptoms likely get?","What would happen if someone touches the inner part of oleandor plant stems and then eats without washing their hands, and how long would it take for symptoms to appear?",How soon would symptoms emerge and how severe would they be if oleandor is ingested after touching the plant's inner stems without washing hands?,What is the expected timeframe for symptoms to develop and their potential severity if someone ingests oleandor by touching the plant's inner stems and eating without handwashing?,"If someone touches the inner part of an oleandor plant stem and then eats without washing their hands, when can they expect symptoms to start, and how bad might they get?"
Q24,i have a problem of ingrown toenail its about 4 years now I have this problem i need help,"I've been dealing with an ingrown toenail for about 4 years, can you help me?","For the past 4 years, I've struggled with an ingrown toenail - how can I overcome this issue?","I've had an ingrown toenail problem that's persisted for around 4 years, what can I do about it?","I've been suffering from an ingrown toenail for approximately 4 years, is there a solution?",Can anyone offer guidance on how to tackle an ingrown toenail that's been plaguing me for 4 years?
Q25,Dear sir/ madam. I am a patient suffering from Friedreich's ataxia and i heard there was a medicine for it. In 2009 and since we are looking for the medicine kindly help on this and I have DNA report could You please help us on this as there are two people respective age 22 years and 24 years suffering from it. Looking for your help on this ASAP and please let us know when the medicine will be there in market and attaching two files for your reference,"I'm reaching out as a patient with Friedreich's ataxia, and I've heard that a treatment is available. Could you please assist me in finding this medicine, especially since I have a DNA report and there are two individuals, aged 22 and 24, suffering from this condition?","I'm a patient diagnosed with Friedreich's ataxia and I've been informed that a medication exists for it. Since 2009, I've been searching for this treatment, and I'd greatly appreciate your help in this matter, especially considering I have a DNA report and two family members, aged 22 and 24, are also affected.","As a patient living with Friedreich's ataxia, I'm seeking assistance in finding a suitable medication. I've heard that a treatment option has been available since 2009, and I'd be grateful if you could guide me through this process, particularly given that I have a DNA report and two individuals, aged 22 and 24, are suffering from this condition.","I'm writing to inquire about a potential treatment for Friedreich's ataxia, a condition I've been diagnosed with. I've been searching for a cure since 2009 and would appreciate your help in this matter, especially considering I have a DNA report and two family members, aged 22 and 24, are also affected by this condition.","I'm a patient with Friedreich's ataxia and I'm reaching out for guidance on finding a suitable medication. I've heard that a treatment has been available since 2009, and I'd greatly appreciate your assistance in this matter, especially given that I have a DNA report and two individuals, aged 22 and 24, are suffering from this condition."
