questionid,original,v1,v2,v3,v4,v5
Q210,I have a dy lumbar puncture that shows two chambers dye did not go further then l4-l5 I have a sixth lumbar upper back deformed spinal cord hematoma on T12 no disk between t2-t3 I have bladder and loss of feeling in right leg I have full medical benifits as an incapacitated child from the military either my new base doctor is unfamiliar with my condition or refuses to acknowledge my problems I told him I have digestive issues and needed my usual meds he treated me like it was due to other meds I get treated so unfairly and badly because I am so young and do t fit the worst form of Spina bifida to top it off now they lost all my child hood care records and this is leaving me defending myself against military doctors when all the tests I can think of have been do e again MRI shows bone birth defects but the dual spinal chambers was shown in a dye lumbar puncture is there a sure fire test they can do that will shut them up an say yep this is what it is,"Is there a definitive test that can confirm the diagnosis of a dual spinal chamber condition, particularly in cases where a dye lumbar puncture has already shown two chambers, but the doctor is unfamiliar or refuses to acknowledge the patient's symptoms and medical history?","What test can be performed to conclusively diagnose a spinal condition characterized by a sixth lumbar upper back deformed spinal cord hematoma on T12, no disk between T2-T3, bladder issues, and loss of feeling in the right leg, especially when the doctor is skeptical or uninformed about the patient's condition?","Can a specific test be administered to verify the presence of a dual spinal chamber condition, as demonstrated by a dye lumbar puncture, and rule out other potential causes of symptoms such as digestive issues, when the doctor is dismissive of the patient's concerns?","How can a patient with a complex spinal condition, including a dual spinal chamber, deformed spinal cord hematoma, and other symptoms, obtain a conclusive diagnosis when the doctor is unfamiliar or uncooperative, and the patient's childhood medical records are lost?","What is the most reliable test to confirm a diagnosis of Spina bifida, or a similar condition, when a dye lumbar puncture has shown two spinal chambers, and the patient is experiencing symptoms such as bladder issues, loss of feeling in the right leg, and digestive problems, but the doctor is skeptical or unresponsive?"
Q211,"I have been diagnosed with SCA3. I was wondering if MedlinePlus is able to help me with resources that I may need on my journey through this disease? If not, can you help me find an organization or association that can help me.",I've been diagnosed with SCA3 and I'm looking for resources to help me navigate this disease - can MedlinePlus assist me in finding what I need?,"Following my SCA3 diagnosis, I'm seeking resources and support - is MedlinePlus a good place to start?","As someone with SCA3, I'm trying to find reliable resources and organizations that can help me - can MedlinePlus point me in the right direction?","After being diagnosed with SCA3, I'm looking for guidance and resources - are there any organizations or associations that MedlinePlus can recommend?",I've recently been diagnosed with SCA3 and I'm not sure where to turn for help - can MedlinePlus or another organization provide me with the resources and support I need?
Q212,What should I do if I have a cold sore? and treatments I use,"What steps should I take if I have a cold sore, and what treatments are effective?","How can I manage a cold sore, and what are some common treatments used?","What are the best ways to deal with a cold sore, and what treatments should I consider?","If I have a cold sore, what should I do to alleviate the symptoms, and what treatments are available?","What are the recommended actions to take if you have a cold sore, and what treatments can help?"
Q213,hi my name is Miranda Ramirez I'm currently working with Friends Community Center in Hollywood California and I was wondering  I came across some of you healthy tip fliers for HIV/Aids treatment .at the moment we have a study  going on that helps HIV positive transgender women into HIV quality care .so it would be great to have some more information on HIV/Aids treatment,"Hi, I'm Miranda Ramirez from Friends Community Center in Hollywood, California, and I'm reaching out because I came across your HIV/AIDS treatment flyers - can you provide more information on this topic since we're currently conducting a study that helps HIV-positive transgender women access quality HIV care?","Miranda Ramirez from Friends Community Center in Hollywood, California here - I stumbled upon your HIV/AIDS treatment flyers and I'd love to learn more about them, especially since our organization is running a study that focuses on getting HIV-positive transgender women into quality care.","I'm Miranda Ramirez, and I work at Friends Community Center in Hollywood, California - I recently came across your HIV/AIDS treatment flyers and I'm interested in learning more about them, as they relate to our current study that helps HIV-positive transgender women access quality care.","Hi, this is Miranda Ramirez from Friends Community Center in Hollywood, California - I found your HIV/AIDS treatment flyers and I was wondering if you could provide more information on this topic, as it's relevant to our ongoing study that supports HIV-positive transgender women in receiving quality care.","Miranda Ramirez from Friends Community Center in Hollywood, California - I came across your HIV/AIDS treatment flyers and I'd appreciate it if you could share more information about them, given our organization's current study that aims to get HIV-positive transgender women into quality HIV care."
Q214,I work at the Airport and I am in contact with hundreds of people a day. I want to be sure that I am not going to expose people to Shingles. When is it safe for me to go back to work?,"How long after having Shingles should I wait before returning to work at the Airport, where I interact with hundreds of people daily?","As an Airport employee who comes into contact with hundreds of people every day, when can I safely return to work after having Shingles?","After contracting Shingles, what is the recommended time frame for me to wait before resuming my duties at the Airport, where I interact with large numbers of people?","When can I go back to my job at the Airport, where I'm in contact with hundreds of people daily, after having Shingles without risking the health of others?","What is the safe waiting period after having Shingles before I can return to my Airport job, where I have daily interactions with hundreds of people?"
Q215,I was diagnosed with sleep apnea (prolly had it for 5 years) and I have swelling issues caused from that (it has been ruled out from everything else so the doctor thinks).  I just got my cPap machine.  I was wondering how long will it take for the swelling to go away.  Thank you!,"I've been diagnosed with sleep apnea, which I've likely had for about 5 years, and it's causing swelling issues that can't be attributed to anything else, according to my doctor. Now that I've got my cPap machine, I'm wondering when I can expect the swelling to subside.","Since being diagnosed with sleep apnea, which I've probably had for five years, I've experienced swelling issues that my doctor thinks are related to the condition. With my new cPap machine, how long will it take for the swelling to resolve?","Having recently received a diagnosis of sleep apnea, which I've likely had for around five years, I've developed swelling issues that my doctor believes are connected to the condition. Now that I have a cPap machine, can you tell me how long it'll take for the swelling to go away?","I've just been diagnosed with sleep apnea, which I've probably had for five years, and I'm experiencing swelling issues that my doctor thinks are a result of the condition. How long will it take for the swelling to disappear now that I've got a cPap machine?","Diagnosed with sleep apnea, which I've likely had for around five years, I've developed swelling issues that can't be explained by anything else, according to my doctor. With my new cPap machine, what's the timeline for the swelling to reduce?"
Q216,How can I get Information on Cronic Lymphocytice Leukemia sent to me thru MedlinkPlus or which way you will send them.,Can you provide me with information on Chronic Lymphocytic Leukemia through MedlinkPlus or an alternative method?,How do I receive information on Chronic Lymphocytic Leukemia via MedlinkPlus or other means?,What are the steps to obtain information on Chronic Lymphocytic Leukemia through MedlinkPlus or alternative channels?,Is it possible to have information on Chronic Lymphocytic Leukemia sent to me through MedlinkPlus or other ways?,"What method will you use to send me information on Chronic Lymphocytic Leukemia, MedlinkPlus or otherwise?"
Q217,"Dear Sir/Madam, I am writing you on behalf of Madam Saavedra, who is very stress and with a lot of tension,looking for HELP for her daughter Mariagracia.  Mariagracia has a complex hearth defect called Tetralogy of Fallot, she is about 7 months old and her family dont have resources to cover her treatment in order to get her welfare.  Madam Saavedra has a very low income, lives in a rented room with her husband and her two children, in Lima - Peru. She works at National Hospital Cayetano Heredia and she has been taking her daughter to children hospital in Lima but she cant afford the medicines and treatment that they ask for, she is looking desperately for help for her daughter.  I was wondering if you guys have any contact here in Lima of any organization, who can help Madam Saavedra. I have been looking but cant find or never not came back to me when I asked them.  If you please know about any organization who can help us here in Lima Peru, I will really appreciate and we can make help to give Mariagracia a better life :-)  I am a Health and Social care worker and work at the hospital too with the employees. Thank you very much for your time  Karina Montes  kmontes44242@hotmail.com","I am reaching out on behalf of Madam Saavedra, whose daughter Mariagracia suffers from Tetralogy of Fallot, a complex heart defect, and is in dire need of assistance for her treatment. Can you provide any leads on organizations in Lima, Peru that may be able to offer help?","Madam Saavedra is desperately seeking aid for her 7-month-old daughter Mariagracia, who has a severe heart condition called Tetralogy of Fallot. As a low-income family living in Lima, Peru, they are unable to afford the necessary treatment. Are you aware of any organizations in Lima that could provide assistance?","I am writing to inquire about potential resources that may be available to help Madam Saavedra's daughter Mariagracia, who has a complex heart defect called Tetralogy of Fallot and is in need of urgent medical attention. Do you know of any organizations in Lima, Peru that could offer support?","On behalf of Madam Saavedra, I am seeking assistance for her daughter Mariagracia, a 7-month-old infant with a severe heart condition. As a low-income family in Lima, Peru, they are struggling to access the necessary treatment. Can you provide information on organizations in Lima that may be able to help?","I am reaching out to ask if you are aware of any organizations in Lima, Peru that could provide aid to Madam Saavedra's daughter Mariagracia, who has a complex heart defect called Tetralogy of Fallot and requires urgent medical attention."
Q218,Can older infants get jaundice? What is the age range?,"At what age can infants develop jaundice, and is it limited to newborns?","Is jaundice only a concern for newborns, or can older infants also be affected?",What is the age range for infants to be at risk of developing jaundice?,"Can jaundice occur in infants beyond the newborn stage, and if so, up to what age?","Are older infants still susceptible to jaundice, and if so, what is the typical age range?"
Q219,"Hello dear Dr, i am  an afghan student in UKM university in malaysia, the mouth ulcer problem is the worst problem in my lifetime, even three or four times the ulcer grow up in the mouth during of a month. even i can not eat or drink, even though i take care of my mouth every day, so i wish you to consult me about of removing of these ulcer forever. thank you so much","I'm an Afghan student at UKM university in Malaysia, and I'm desperate for a solution to my recurring mouth ulcer problem that's been plaguing me for a long time.","As an Afghan student studying at UKM university in Malaysia, I'm seeking your expert advice on how to permanently get rid of the painful mouth ulcers that keep appearing three to four times a month.","I'm an Afghan student at UKM university in Malaysia, and I'm at my wit's end with the frequent mouth ulcers that have been affecting my daily life, including eating and drinking, despite my best efforts to maintain good oral hygiene.","I'm reaching out to you, Dr, as an Afghan student at UKM university in Malaysia, hoping you can help me find a way to stop the recurring mouth ulcers that have been causing me so much distress, even when I take good care of my mouth.","As an Afghan student at UKM university in Malaysia, I'm turning to you for guidance on how to overcome the debilitating mouth ulcer issue that's been a persistent problem for me, with new ulcers appearing every month."
Q220,Can Arachnoid Cysts Cause Pain/?I Have A Shuntfrom2007.How OftenDo They Need Changed?,"Do arachnoid cysts have the potential to cause pain, and how often do shunts, like the one I got in 2007, need to be replaced?","I have had a shunt since 2007; can arachnoid cysts cause discomfort, and what is the typical replacement frequency for these devices?","Are arachnoid cysts capable of causing pain, and how often do shunts, such as the one I've had since 2007, require replacement or maintenance?","Can arachnoid cysts lead to painful symptoms, and what is the average lifespan of a shunt like the one I received in 2007 before it needs to be replaced or serviced?","I've had a shunt in place since 2007; do arachnoid cysts have the potential to cause pain, and what is the recommended replacement or maintenance schedule for these devices?"
Q221,"Are large, inoperable schwannomas treatable or able to be shrunk with chemotherapy or radiation?","Can large, inoperable schwannomas be shrunk or treated with chemotherapy or radiation?","Are chemotherapy and radiation effective in treating or shrinking large, inoperable schwannomas?","Can chemotherapy or radiation be used to treat or reduce the size of large, inoperable schwannomas?","Is it possible to shrink or treat large, inoperable schwannomas using chemotherapy or radiation?","Do chemotherapy and radiation have a role in treating or reducing the size of large, inoperable schwannomas?"
Q222,"I want more information on Hypertension and fibromyalgia, I seem to be getting only topics on diabetes and I do not have this.   I enjoy reading the current info.  thanks Cassie Caldera","Can you provide more information on Hypertension and fibromyalgia, as I'm only getting topics on diabetes and I don't have this condition?","I'm interested in learning more about Hypertension and fibromyalgia, but I keep getting information on diabetes, which isn't relevant to me.","How can I access more information on Hypertension and fibromyalgia, as the current topics seem to focus on diabetes, which I don't have?","I'm not getting the information I need on Hypertension and fibromyalgia, as most of the topics are about diabetes, which isn't my concern.","Is it possible to get more information on Hypertension and fibromyalgia, as I'm only seeing topics on diabetes, which doesn't apply to me?"
Q223,Hello i would like more info about Familial Mediterean Fever please as my husband suffers from this. THANKS,"I'm seeking information about Familial Mediterranean Fever, as my husband has been diagnosed with this condition.","Can you provide more information on Familial Mediterranean Fever, as it affects my husband?","I'd appreciate it if you could share more details about Familial Mediterranean Fever, which my husband suffers from.","My husband has Familial Mediterranean Fever, and I'd like to learn more about this condition.","Could you offer more insight into Familial Mediterranean Fever, a condition that my husband is dealing with?"
Q224,I just read an article submitted by you that stated your research shows that you've identified the mechanism that causes burning mouth syndrome. Also because of these findings you can find a treatment. I've had this for 15 yrs and am just holding on. When will a good treatment be available??  I belong to a group of over 500 bmsers. We're suffering terribly and were from all over the world. What would the treatment be?,"I've read an article about your research on burning mouth syndrome, which claims you've found the underlying mechanism and a potential treatment - when can we expect a viable treatment option to become available?",Your recent article on burning mouth syndrome mentioned that your research has uncovered the cause of the condition and a possible treatment - how soon can we expect a reliable treatment to be accessible?,"I came across an article you wrote about your burning mouth syndrome research, which suggests you've identified the root cause and a potential cure - when might a trustworthy treatment become available to sufferers like myself?",I've been following your research on burning mouth syndrome and was thrilled to see that you've made progress in understanding the mechanism behind it and finding a possible solution - what's the timeline for a treatment becoming widely available?,Your article on burning mouth syndrome research caught my attention - you mentioned discovering the underlying cause and a potential treatment path - can you estimate when a treatment will be accessible to those of us who have been suffering from this condition for years?
Q225,"Hi,  I'm suffering from nodular goiter. The size of enlarged thyroid gland is visible, but not like a big one. I need treatment for this. Some Doctors have suggested surgery which I don't want to go through. What are the other treatment options. Also let me know the place where I can visit to consult.  Thanks, Shweta",I have a nodular goiter and the enlarged thyroid gland is noticeable but not severely swollen. I'm looking for alternative treatment options as I'm hesitant about surgery. Can you recommend some other treatments and a specialist to consult?,"I've been diagnosed with a nodular goiter, and while it's visible, it's not extremely large. I'm not keen on undergoing surgery, so I'd like to explore other treatment options. Additionally, could you suggest a reputable doctor or medical facility for consultation?","Shweta here, and I've been dealing with a nodular goiter. The enlargement is apparent but not dramatic. I'm hesitant about surgery and would like to know about other possible treatments. Also, could you recommend a specialist or clinic for further guidance?","Hi, I have a nodular goiter, and the thyroid gland is visibly enlarged, although not excessively so. I'm not interested in surgery and would like to explore alternative treatments. Could you please suggest some options and a doctor or medical center to visit for consultation?","I'm Shweta, and I've been diagnosed with a nodular goiter. While the thyroid gland is enlarged, it's not severely swollen. I'm reluctant to undergo surgery and would like to know about other treatment options available. Additionally, could you recommend a specialist or medical facility for further evaluation and guidance?"
Q226,I get numbness to the body alot what should I do,I frequently experience numbness throughout my body - what steps should I take?,What should I do if I'm experiencing recurring numbness in my body?,I often feel numbness in my body - what's the best course of action for me?,What are the recommended steps for addressing frequent numbness in the body?,How can I address the numbness I regularly experience in my body?
Q227,"after surgery for achalasia, will spasms continue in the upper chest area and if so what can assist in ending spasms","Following achalasia surgery, do spasms typically persist in the upper chest area, and if so, what remedies can alleviate them?","Will chest spasms above the chest persist after surgery for achalasia, and what methods can be employed to stop them?","Do upper chest spasms usually continue after achalasia surgery, and what treatments can help eliminate them?","Can chest spasms in the upper area be expected to continue after surgery to treat achalasia, and what can be done to make them stop?","What is the likelihood of continued spasms in the upper chest area after achalasia surgery, and how can they be alleviated?"
Q228,I LIKE TO KNOW RECENT THERAPY ON ARRHYTHMIA OF HEART,What are the latest therapies for heart arrhythmia?,Can you update me on recent heart arrhythmia therapies?,What are the current treatment options for heart arrhythmia?,Are there any new therapies for treating heart arrhythmia?,What are the most recent advancements in heart arrhythmia therapy?
Q229,"Hi,  I  want to know about Lupus and its treatment. Best,  Mehrnaz",Can you provide information about Lupus and its treatment options?,"I am looking for information on Lupus, including its treatment methods.",What can you tell me about Lupus and how it is treated?,"I need information on Lupus, specifically its treatment and management.",Could you enlighten me about Lupus and the available treatment approaches?
Q230,"Can high doses of Vitamin D (50,000 IUs per week) cause flatulence, among other possible effects?  And is such a high dose safe to raise very low levels of Vitamin D in the body?","Are high doses of Vitamin D, such as 50,000 IUs per week, associated with flatulence and other potential effects?","Does taking 50,000 IUs of Vitamin D per week lead to flatulence, among other possible side effects, and is this dose safe for correcting very low Vitamin D levels?","Can a weekly dose of 50,000 IUs of Vitamin D cause flatulence and other issues, and is it a safe and effective way to raise very low Vitamin D levels in the body?","Is it true that high doses of Vitamin D, specifically 50,000 IUs per week, can cause flatulence and other effects, and are such doses safe for treating very low Vitamin D levels?","What are the potential effects of taking 50,000 IUs of Vitamin D per week, including flatulence, and is this dose safe for addressing very low Vitamin D levels in the body?"
Q231,"i have thrown up twice tonight and i have very bad tightness in the chest but my nasal and throat are clear. i have just started on patches to help me quit smoking and I'm an asthmatic but atm it feels like no oxygen  is staying in but i have a pulse, and i also have been suffering anxiety, is the patches affecting my asthma and breathing?","I've vomited twice tonight and I'm experiencing severe chest tightness, but my nasal and throat are clear; I've just started using patches to quit smoking and I have asthma - could the patches be impacting my asthma and breathing?","Having thrown up twice tonight, I'm feeling extremely tight in the chest, despite having clear nasal and throat passages; I've recently started using nicotine patches to quit smoking, and as an asthmatic, I'm wondering if the patches are affecting my asthma and breathing?","I've had two episodes of vomiting tonight, accompanied by severe chest tightness, although my nasal and throat areas are clear; I've just begun using nicotine patches to help me quit smoking, and as someone with asthma, I'm concerned that the patches might be influencing my asthma and breathing?","Tonight, I've experienced two instances of vomiting, along with very bad chest tightness, but my nasal and throat areas are clear; I've started using nicotine patches to quit smoking, and as an asthmatic, I'm worried that the patches could be affecting my asthma and breathing?","After throwing up twice tonight and feeling extremely tight in the chest, despite having clear nasal and throat passages, I'm concerned that the nicotine patches I've just started using to quit smoking might be impacting my asthma and breathing, especially given my history of asthma and recent anxiety struggles?"
Q232,i have lymphoma what causes cramp after chemo treatment,What triggers cramps in lymphoma patients after chemotherapy treatment?,Are cramps a common side effect of chemotherapy for lymphoma patients?,Why do I experience muscle cramps after undergoing chemotherapy for lymphoma?,"Can chemotherapy for lymphoma cause muscle cramps, and if so, why?",What is the explanation for post-chemotherapy muscle cramps in individuals with lymphoma?
Q233,my father age 65 his always leg pain which use medicine,What medication does my 65-year-old father use for his chronic leg pain?,"Which medicine has been prescribed to my father, who is 65 and suffers from leg pain?",What is the medication that my 65-year-old father takes to alleviate his leg pain?,"Can you tell me the name of the medicine that my father, who is 65, uses to treat his leg pain?","What medication has been recommended for my father's leg pain, considering he is 65 years old?"
