questionid,original,v1,v2,v3,v4,v5
Q87,Is there any way you could send me information on both these heart conditions? My son has to get tested for them eventually and I would just like information to understand the conditions of both of them more.,Could you provide me with information on both heart conditions so I can better understand them before my son gets tested?,I'm looking for information on two specific heart conditions that my son may have - can you send me some details?,I want to educate myself on two heart conditions my son may be tested for - can you provide some information on both?,My son will be getting tested for two heart conditions soon and I'd like to learn more about them - can you send me some information?,I need information on two heart conditions my son may have - is there a way you could send me some details on both of them?
Q88,I'm a vietnam navy veteran whose traditional stroke thearapy has failed miserably,"I'm a navy veteran from Vietnam, and my traditional stroke therapy has been unsuccessful.","As a Vietnam navy veteran, what alternatives do I have since traditional stroke therapy didn't work for me?","What are my options now that traditional stroke therapy has failed me, a Vietnam navy veteran?","I'm a Vietnam veteran who served in the navy, and I'm looking for alternatives to traditional stroke therapy, which didn't work.",What's the next step for a Vietnam navy veteran like me whose traditional stroke therapy has been ineffective?
Q89,Haglund's deformity of the calcaneum.  I have this problem.  Can you please help to overcome this?,"I'm struggling with Haglund's deformity of the calcaneum, can you offer some guidance?","How can I manage Haglund's deformity of the calcaneum, which I've been diagnosed with?",I've developed Haglund's deformity of the calcaneum; what steps can I take to alleviate the issue?,"Can you provide advice on overcoming Haglund's deformity of the calcaneum, a condition I'm dealing with?",I'm experiencing Haglund's deformity of the calcaneum; are there any effective ways to cope with this condition?
Q90,williams sydrome conditon.  i need to send me more information about Williams Syndrome and some tips how to educate people with this disorder.I hope having news from you soon!!thank you ,Can you provide more information about Williams Syndrome and offer some tips on educating individuals with this condition?,I need information about Williams Syndrome; could you also provide some guidance on how to educate people with this disorder?,"I'm looking for information on Williams Syndrome, as well as some advice on educating individuals with this condition - can you help?",Could you send me information about Williams Syndrome and some tips on how to educate people with this disorder?,"I'm seeking information about Williams Syndrome, including some guidance on educating individuals with this condition - can you assist me?"
Q91,Please i want to know the cure to Adenomyosis. I have been going through alot of pains during my menstruation. I want to see a specialist doctor to help me out. I am dying with pains.,I'm suffering from Adenomyosis and experiencing severe menstrual cramps - can a specialist doctor provide a cure?,"What is the most effective treatment for Adenomyosis, as I'm struggling with debilitating menstrual pain and need to see a specialist?",I'm desperate for relief from Adenomyosis-related menstrual pain - can a specialist doctor offer a solution or cure?,How can I find a specialist doctor who can help me overcome the excruciating menstrual pain caused by Adenomyosis?,"What are the available treatment options for Adenomyosis, as I'm tired of living with agonizing menstrual cramps and want to consult a specialist?"
Q92,My brother need treatment for muscular dystrophy,What kind of treatment does my brother need for muscular dystrophy?,Does my brother require medical attention for muscular dystrophy?,What medical care does my brother need to address muscular dystrophy?,Is treatment necessary for my brother's muscular dystrophy?,What are the treatment options for my brother's muscular dystrophy?
Q93,What ia the lowest starting dose of Citalopram?,What is the initial dose of Citalopram that is recommended?,What is the smallest dose of Citalopram that a patient can start with?,What dose of Citalopram is considered the lowest starting point?,Can you tell me the lowest dose of Citalopram that a doctor would prescribe?,What is the minimum starting dose of Citalopram that is typically used?
Q94,ClinicalTrials.gov - General Complaint.  I have had undisguised ADHD since I was 8 years old. I sold illicit drugs from 1979-1989 in large quantity's & self medicated with amphetamines as an adolescent which damaged my Brian & worsened my symptoms. Because I have had several drug induced psychotic episodes since I was busted for trafficking in 1989 & was unable to self medicate on a daily basis. I was wrongly diagnosed with schizophrenia 9years ago. The community psychiatrist's have treated me with all the wrong medication's that have made my ADHD symptoms worse & forced me to self medicate until now. I have no assets or money & I don't think it is worth while going on with out being put on the right medication Ritalin. When I take Meth amphetamines my symptoms improve & I haven't had any anti psychotic medication for 13 month's & have not gone psychotic or had any negative symptoms of schizophrenia. Can you suggest any type of tests I can do to prove I have Adult ADHD or a psychiatrist I can see in [LOCATION] Australia. Who can help me ,"I've had ADHD since childhood, self-medicated with amphetamines, and was wrongly diagnosed with schizophrenia. Can you recommend tests to confirm Adult ADHD or a psychiatrist in [LOCATION] Australia who can assist me?","Having lived with ADHD since age 8, I've experienced worsened symptoms due to past drug use and incorrect medication. How can I prove I have Adult ADHD, and are there psychiatrists in [LOCATION] Australia who can provide the right treatment?","I've struggled with ADHD since childhood, used drugs to self-medicate, and was misdiagnosed with schizophrenia. What tests can I take to confirm my Adult ADHD diagnosis, and are there psychiatrists in [LOCATION] Australia who can help me get the right medication?","As someone who's had ADHD since age 8, I've tried self-medicating with amphetamines and was wrongly diagnosed with schizophrenia. Can you suggest any tests to prove my Adult ADHD diagnosis or recommend a psychiatrist in [LOCATION] Australia who can provide the correct treatment?","With a history of ADHD since childhood, I've experienced worsened symptoms due to past drug use and incorrect medication. Are there any tests I can take to confirm my Adult ADHD diagnosis, and are there psychiatrists in [LOCATION] Australia who can help me get the right treatment, such as Ritalin?"
Q95,"Hi, I am a grade 12 student who is doing a research assignment on neurological disorders. Do you believe that there will ever be a bonafide cure for Multiple Sclerosis? If so, what kind of time frame would put on this cure?","As a high school senior working on a research project about neurological disorders, I'm wondering if you think there will ever be a definitive cure for Multiple Sclerosis, and if so, what kind of timeline do you envision for this cure?","I'm a 12th grader conducting research on neurological disorders and I'm curious to know if you believe a genuine cure for Multiple Sclerosis is possible, and if it is, what kind of time frame do you predict for its development?","As I work on my research assignment about neurological disorders, I'm interested in knowing if you think a cure for Multiple Sclerosis will ever be discovered, and if it will, what kind of time frame do you think it will take to develop it?","I'm a grade 12 student researching neurological disorders and I'd love to know if you think there will ever be a cure for Multiple Sclerosis, and if there will be, what kind of time frame do you think it will take to develop a cure?","As a senior in high school working on a research project about neurological disorders, I'm wondering if a cure for Multiple Sclerosis is something you think will ever be possible, and if it is, what kind of time frame do you think it will take to develop a cure for this disease?"
Q96,"Achondroplasia research.  Hello, We are students from [LOCATION] and we are doing a biology project of genetic diseases. We chose Achondroplasia as our disease to research. We have a few question and we are hoping you could answer them. Our questions are, can you tell if your child will have Achondroplasia when you are pregnant? When do people usually come in when they think something isn't right with their child? what are the worse cases of Achondroplasia you've ever seen? Thank you in advance. sincerely, [NAME] ","We are students from [LOCATION] conducting a biology project on genetic diseases, specifically Achondroplasia. We were wondering if it's possible to determine during pregnancy whether a child will have Achondroplasia. Additionally, at what stage do parents usually seek medical attention if they suspect something is wrong with their child? Lastly, what are some of the most severe cases of Achondroplasia you've encountered?","As part of our biology project on genetic diseases, we're researching Achondroplasia and have a few questions. Is it possible to diagnose Achondroplasia during pregnancy? At what age do parents typically bring their child to see a doctor if they're concerned about their development? Can you share some of the most severe cases of Achondroplasia you've seen?","For our biology project, we've chosen to research Achondroplasia, a genetic disease. We're curious to know if prenatal testing can detect Achondroplasia. When do parents usually become aware of potential issues with their child's development and seek medical help? What are some of the most extreme cases of Achondroplasia you've come across?","As students from [LOCATION], we're working on a biology project focused on genetic diseases, with Achondroplasia being our topic of choice. We'd like to know if it's possible to determine if a child will have Achondroplasia during pregnancy. At what point do parents usually seek medical attention if they suspect something is amiss with their child? Can you describe some of the most severe cases of Achondroplasia you've encountered?",We're students from [LOCATION] conducting research on Achondroplasia for our biology project on genetic diseases. We're wondering if prenatal testing can identify Achondroplasia. When do parents typically become concerned about their child's development and seek medical help? What are some of the most severe cases of Achondroplasia you've seen in your experience?
Q97,I'm calling because I would like to know more advice on crating Risperdoine medicine and gain experiences on the medication. And creating the medication,Can you provide guidance on creating Risperdoine medicine and share experiences with the medication?,I'm seeking advice on the development of Risperdoine medicine and would like to hear about experiences with this medication.,"What insights can you offer on manufacturing Risperdoine medicine, and are there any experiences you can share about the medication?",I'd like to learn more about the production of Risperdoine medicine and hear about others' experiences with this medication.,Could you offer expertise on formulating Risperdoine medicine and share your experiences with the medication?
Q98,Is optic atrophy ginetic and what cause it?,Is optic atrophy a genetic condition and what triggers it?,"What are the causes of optic atrophy, and is it genetic in nature?","Does optic atrophy have a genetic component, and what are the underlying causes?",Can you explain the causes of optic atrophy and whether it's a genetic disorder?,"Is optic atrophy caused by genetic factors, and what are the underlying mechanisms?"
Q99,What is the connection (if any) between Essential Tremor and Parkinsons and what is the best treatment for Essential Tremor?,"Is there a link between Essential Tremor and Parkinson's, and what is the most effective treatment for Essential Tremor?","What is the relationship (if any) between Essential Tremor and Parkinson's disease, and how is Essential Tremor best treated?","Are Essential Tremor and Parkinson's related, and what is the recommended treatment approach for Essential Tremor?","Do Essential Tremor and Parkinson's share a connection, and what treatment options are available for Essential Tremor?","How do Essential Tremor and Parkinson's disease compare, and what is the ideal treatment strategy for Essential Tremor?"
Q100,"My doctor does not know of a medication that can be used in the mouth for dry mouth. Through research, I think the medication is there, I just can't find the name of it for him to prescribe forme. Can you help me. I'm using the across the counter Biotene but would like something that works a little better.","I'm searching for a prescription medication to treat dry mouth that can be applied directly to the mouth, but my doctor is unaware of any such option - can you assist me in finding it?","Is there a medication that can be used in the mouth to combat dry mouth that my doctor might not know about, and if so, what is its name?","I've been using over-the-counter Biotene for dry mouth, but I'm looking for a more effective prescription alternative that can be applied directly to the mouth - do you have any information on such a medication?",My doctor is not aware of a medication that can be used in the mouth to treat dry mouth - can you help me identify a suitable prescription option?,"I believe there is a medication available that can be applied directly to the mouth to treat dry mouth, but I need help finding its name so my doctor can prescribe it for me."
Q101,"Hi,  I  want to know about Lupus and its treatment. Best,  [NAME]",Can you provide information about Lupus and its treatment options?,"I am seeking knowledge about Lupus, including its treatment methods.",What can you tell me about Lupus and how it is typically treated?,I would appreciate it if you could enlighten me about Lupus and its various treatments.,Could you please share your knowledge about Lupus and the different ways it can be treated?
Q102,"How can I determine whether or not I've had chicken pox.  If there is a test for it, what are the results of the tests I need to know that will tell me whether or not I have had chicken pox?  I want to know this to determine if I should have shingles vaccine  (Zostavax) Thank you.","What method can I use to find out if I've had chicken pox, and what test results indicate that I've had the disease, so I can decide about getting the shingles vaccine?","How do I know if I've had chicken pox, and are there any tests that can confirm it, which would help me determine if I should get the Zostavax vaccine?","Is there a way to determine if I've had chicken pox, and what test results would indicate that I've had it, so I can make an informed decision about the shingles vaccine?","Can I find out if I've had chicken pox, and if so, what test results would confirm it, which would help me decide whether or not to get the Zostavax vaccine?","What's the best way to figure out if I've had chicken pox, and what test results do I need to look for to determine if I should get the shingles vaccine?"
Q103,Project. Hi my name is [NAME] and I'm doing a school project about leukemia and I was wondering if you can anwser some of my questions please.1. What cause leukemia cancer?2. Can you survive leukemia?3. How does leukemia affect your body?4. Is leukemia inherited?5. What is advanced leukemia?6. How long can someone with leukemia expect to live?7. Can you tell if you have leukemia?8. What treatments do you need to take?9. What are the signs of leukemia?10. What is the difference between AML and CML ? ,,,,,
Q104,"I have been dealing with an autoimmune disease for almost 4 years now, I've been tested for many things and the doctors can't seem to find what excactly is wrong. It began with pain, swelling and stiffness in my feet and  toes.A lot of the pain is joint stiff n ess and my skin feels like its being burned. Over time it has moved into my knees also. I am always tired. Recently I've been getting pains in my stomache and feeling sick. Does any of this sound like Lupus?? I've tested negative for it before, but the more I read about it I feel that's what i could have. Any ideas would be greatly appreciated.","I've been experiencing symptoms of an autoimmune disease for almost 4 years, including foot and toe pain, swelling, and stiffness, as well as joint stiffness, skin burning sensations, and fatigue. Lately, I've also been having stomach pains and nausea. Could my symptoms be indicative of Lupus, despite previously testing negative?","For nearly 4 years, I've been struggling with an autoimmune disease, characterized by pain, swelling, and stiffness in my feet and toes, as well as joint stiffness, burning skin sensations, and exhaustion. Recently, I've developed stomach pains and nausea. Do my symptoms sound like they could be related to Lupus, even though I've tested negative in the past?","I've been dealing with an undiagnosed autoimmune disease for almost 4 years, with symptoms including foot and toe pain, swelling, and stiffness, as well as joint stiffness, skin burning sensations, and constant fatigue. Lately, I've also been experiencing stomach pains and nausea. Could my symptoms be consistent with Lupus, despite a previous negative test result?","I've had an autoimmune disease for nearly 4 years, marked by pain, swelling, and stiffness in my feet and toes, as well as joint stiffness, burning skin sensations, and exhaustion. Recently, I've developed stomach pains and nausea. Do you think my symptoms could be related to Lupus, even though I've tested negative before?","For almost 4 years, I've been experiencing symptoms of an autoimmune disease, including foot and toe pain, swelling, and stiffness, as well as joint stiffness, skin burning sensations, and constant fatigue. Lately, I've also been having stomach pains and nausea. Could Lupus be a possible diagnosis for me, despite previously testing negative?"
Q105,"EMAIL: [EMAIL] FROM:  http://m.medlineplus.gov/medlineplus.htm  BROWSER: NokiaX2-01/5.0 (07.10) Profile/MIDP-2.1 Configuration/CLDC-1.1 Mozilla/5.0 AppleWebKit/420  (KHTML, like Gecko) Safari/420  DATE: 01/06/2014   MESSAGE: My question is.wat is the treatment  for chronic gonorrhea, massive growth? ",What is the treatment for chronic gonorrhea with massive growth?,How is chronic gonorrhea with massive growth typically treated?,What are the treatment options for chronic gonorrhea accompanied by massive growth?,Can you provide information on treating chronic gonorrhea when it's accompanied by massive growth?,What is the recommended course of treatment for chronic gonorrhea with massive growth?
Q106,is this a safe decision,Is this choice a wise one?,Will this decision have no negative consequences?,Is it prudent to make this decision?,Should I be confident in this choice?,Is making this decision a risk-free move?
Q107,Can you provide something to help grow my hair back? I need my hair back as im the spitting double of Dr evil with no hair.,"Is there a solution to help me regrow my hair, as I'm struggling with hair loss and it's affecting my Dr. Evil impersonation?","What can I use to stimulate hair growth, as I'm desperate to regain my Dr. Evil look, which is being ruined by my current hair loss?","Do you know of any hair growth remedies that could help me regain my iconic Dr. Evil appearance, which is being compromised by my lack of hair?","How can I promote hair growth and restore my Dr. Evil-esque look, which is suffering due to my current hair loss?","Are there any hair regrowth treatments that could help me regain my confidence and Dr. Evil-like appearance, which is being hindered by my hair loss?"
Q108,I would like help on my obesity problem and if I can get help,"I need assistance with my weight issue, is there any help available?",Can you provide guidance on overcoming obesity and accessing support?,How can I get help and support for my obesity struggles?,"I'm struggling with obesity, are there any resources or help available to me?",Where can I find assistance and support for my obesity issues?
Q109,"Hey, my name is [NAME]. Last night my vaginal area was itching but I didn't think to much of it.  Well when I woke up this morning it started itching out of control.  I don't see discharge coming from the vaginal area.  Now I do use Summer's Eve vaginal spray, I don't know if it is a vaginal yeast infection or not, but how should I go about this process.","I'm [NAME] and I've been experiencing some itching in my vaginal area since last night, which has gotten worse this morning. I don't see any discharge, but I do use Summer's Eve vaginal spray. Could this be a yeast infection, and what should I do about it?","I'm [NAME]. I had some itching in my vaginal area last night, but it's gotten much worse this morning. I don't see any discharge, and I use Summer's Eve vaginal spray regularly. Is this possibly a yeast infection, and how should I proceed?","Hi, I'm [NAME]. I've been dealing with vaginal itching since last night, and it's become almost unbearable this morning. I don't notice any discharge, and I use Summer's Eve vaginal spray. Could this be a sign of a yeast infection, and what's the best course of action?","I'm [NAME], and I've been experiencing some vaginal itching since last night. This morning, it's become much worse. I don't see any discharge, and I regularly use Summer's Eve vaginal spray. Do you think this could be a yeast infection, and what should I do about it?","Hi, I'm [NAME]. I've had some vaginal itching since last night, and it's gotten much worse this morning. I don't see any discharge, but I do use Summer's Eve vaginal spray. Is this possibly a yeast infection, and how should I go about treating it?"
Q110,"hello , my daughter has lymph edema her both legs and left hand is swelling , this problem started when she was of 3 months now she is  16 months , her swelling is growing day by day , im clue less what to do and what kind of treatment i should do plz help and suggest us ,","My 16-month-old daughter has lymphedema, which causes swelling in both legs and her left hand. The issue started when she was just 3 months old. The swelling is getting worse every day, and I'm at a loss for what to do or what treatment to pursue. Can you please help and offer some suggestions?","I'm desperate for guidance on how to address my 16-month-old daughter's lymphedema, which is causing her legs and left hand to swell. This problem began when she was only 3 months old, and it's been getting progressively worse. What kind of treatment should I be looking into?","My 16-month-old daughter is experiencing swelling in both legs and her left hand due to lymphedema, which started when she was just 3 months old. As the swelling continues to worsen daily, I'm feeling overwhelmed and unsure of how to proceed. Can you offer some advice on the best course of treatment?","I'm seeking help for my 16-month-old daughter, who has lymphedema that's causing swelling in her legs and left hand. The issue began when she was 3 months old, and it's been getting worse every day. What are some potential treatment options that I should explore?","My daughter is 16 months old and has lymphedema, which is causing her legs and left hand to swell. This problem started when she was just 3 months old, and it's been getting progressively worse. I'm feeling lost and unsure of what to do or what treatment to pursue. Can you please offer some guidance and suggestions?"
Q111,"Duchenne Muscular Dystrophy. I am doing a research project on this genetic disease and I would like to know more about it from a professional.  I am researching the mode of inheritance, symptoms, treatments/ support groups, and relative cost to family. ","I'm conducting research on Duchenne Muscular Dystrophy, a genetic disease, and I'd appreciate expert insight on its mode of inheritance, symptoms, treatments, support groups, and the financial burden on families.","As I delve into my research project on Duchenne Muscular Dystrophy, I'd love to hear from a professional about the genetic aspects of this disease, its symptoms, available treatments, support groups, and the cost to families.","Can you provide me with information on Duchenne Muscular Dystrophy, specifically its mode of inheritance, symptoms, treatment options, support groups, and the financial impact on families, as I'm working on a research project?","I'm working on a research project about Duchenne Muscular Dystrophy and I need expert input on the mode of inheritance, symptoms, treatments, support groups, and the cost to families - can you help?","For my research project on Duchenne Muscular Dystrophy, I'd like to know more about this genetic disease, including its mode of inheritance, symptoms, treatment options, support groups, and the financial burden it places on families."
