questionid,original,v1,v2,v3,v4,v5
Q225,"Hi,  I'm suffering from nodular goiter. The size of enlarged thyroid gland is visible, but not like a big one. I need treatment for this. Some Doctors have suggested surgery which I don't want to go through. What are the other treatment options. Also let me know the place where I can visit to consult.  Thanks, Shweta","I have a nodular goiter and the enlarged thyroid gland is noticeable, but not extremely large. I'm looking for alternative treatments to surgery, which some doctors have recommended. Can you suggest other options and a specialist I can consult with?","Shweta here, I've been diagnosed with nodular goiter, and while my thyroid gland is enlarged, it's not severely swollen. I'm hesitant about undergoing surgery, which some doctors have suggested. What are the non-surgical treatment options available, and where can I find a specialist to consult?","I've been diagnosed with nodular goiter, and my thyroid gland is visibly enlarged, although not excessively so. I'm not keen on surgery, which some doctors have recommended. Can you inform me about alternative treatments and recommend a specialist I can visit for consultation?","Hi, I'm Shweta, and I've been diagnosed with nodular goiter. My thyroid gland is enlarged, but not dramatically so. I'm not interested in surgery, which some doctors have suggested. What other treatment options are available, and where can I find a specialist to consult with?","I have nodular goiter, and my thyroid gland is enlarged, although not extremely large. I'm seeking alternative treatments to surgery, which some doctors have recommended. Can you suggest other options and a specialist I can visit for consultation, thanks?"
Q226,I get numbness to the body alot what should I do,What steps can I take to address frequent numbness in my body?,I often experience numbness throughout my body; what should I do about it?,What are the recommended actions for someone who frequently gets numbness in their body?,How can I alleviate or prevent the numbness I frequently feel in my body?,What should someone do who experiences recurring numbness in their body?
Q227,"after surgery for achalasia, will spasms continue in the upper chest area and if so what can assist in ending spasms","Following achalasia surgery, do upper chest area spasms typically persist and what remedies can alleviate them?","Will chest spasms above the chest area still occur after achalasia surgery, and how can they be stopped?","Are spasms in the upper chest area common after achalasia surgery, and what treatments can help eliminate them?","Do spasms in the upper chest region usually continue after surgery for achalasia, and what can be done to get rid of them?","Can surgery for achalasia completely eliminate spasms in the upper chest area, and if not, what can help manage them?"
Q228,I LIKE TO KNOW RECENT THERAPY ON ARRHYTHMIA OF HEART,Can you tell me about recent therapy for heart arrhythmia?,What are the latest treatments for heart rhythm disorders?,Which recent therapies are used to treat heart arrhythmias?,Do you know about the recent advancements in heart arrhythmia therapy?,What are the current therapeutic approaches for treating heart arrhythmia?
Q229,"Hi,  I  want to know about Lupus and its treatment. Best,  Mehrnaz",I am interested in learning about Lupus and its treatment options.,Can you provide information about Lupus and how it is treated?,I would like to know more about the disease Lupus and its treatment methods.,What do you know about Lupus and its treatment approaches?,Could you enlighten me about Lupus and the ways it is treated?
Q230,"Can high doses of Vitamin D (50,000 IUs per week) cause flatulence, among other possible effects?  And is such a high dose safe to raise very low levels of Vitamin D in the body?","Are high doses of Vitamin D, such as 50,000 IUs per week, associated with flatulence and other potential effects?","Does taking 50,000 IUs of Vitamin D per week lead to flatulence, among other possible side effects?","Can a weekly dose of 50,000 IUs of Vitamin D cause flatulence, as well as other effects, and is it safe to use this dose to correct very low Vitamin D levels?","Is it safe to take high doses of Vitamin D, such as 50,000 IUs per week, to raise very low levels of Vitamin D in the body, and are there potential side effects like flatulence?","What are the potential effects, including flatulence, of taking high doses of Vitamin D, such as 50,000 IUs per week, and is this dose safe for correcting very low Vitamin D levels?"
Q231,"i have thrown up twice tonight and i have very bad tightness in the chest but my nasal and throat are clear. i have just started on patches to help me quit smoking and I'm an asthmatic but atm it feels like no oxygen  is staying in but i have a pulse, and i also have been suffering anxiety, is the patches affecting my asthma and breathing?","I've vomited twice tonight and I'm experiencing severe chest tightness, but my nasal and throat are clear; could the nicotine patches I've just started for quitting smoking be affecting my asthma and breathing, considering I'm an asthmatic and currently feeling like I'm not getting enough oxygen?","Having thrown up twice tonight, I'm dealing with intense chest tightness, but my nasal and throat are clear; as an asthmatic who's just started using nicotine patches to quit smoking, could these patches be impacting my breathing and asthma, given that I'm feeling like I'm not getting enough oxygen right now?","I've had two episodes of vomiting tonight, accompanied by severe chest tightness, although my nasal and throat are clear; as someone who's just begun using nicotine patches to quit smoking and also has asthma, could these patches be exacerbating my asthma and breathing difficulties, which currently feel like I'm not getting enough oxygen?","Tonight, I've experienced two instances of vomiting and severe chest tightness, but my nasal and throat are clear; could the nicotine patches I've recently started using to quit smoking be affecting my asthma and breathing, considering I'm an asthmatic and currently feeling like I'm not getting enough oxygen, and I've also been experiencing anxiety?","I've vomited twice tonight and I'm feeling extremely tight in the chest, but my nasal and throat are clear; as an asthmatic who's just started nicotine patches to quit smoking, are these patches impacting my breathing and asthma, given that I'm feeling like I'm not getting enough oxygen and I've also been dealing with anxiety lately?"
Q232,i have lymphoma what causes cramp after chemo treatment,What triggers cramps in lymphoma patients after chemotherapy treatment?,"Are cramps a common side effect of chemotherapy for lymphoma patients, and if so, what causes them?",I have lymphoma and experience cramping after chemotherapy - what is the underlying cause of this?,What are the causes of post-chemotherapy cramping in individuals with lymphoma?,Can you explain why lymphoma patients often experience cramps after undergoing chemotherapy treatment?
Q233,my father age 65 his always leg pain which use medicine,What medication does my 65-year-old father use for his persistent leg pain?,"Which medicine has been prescribed to my father, who is 65 and suffers from leg pain?","What is the medication that my father, aged 65, takes for his chronic leg pain?",Can you tell me the name of the medicine my 65-year-old father uses to alleviate his leg pain?,"What medication has been recommended for my father's leg pain, considering he is 65 years old?"
Q234,"What  is the best thing to do for my Dad who we are sure has PSP!  Who are the best doctors to treat this disease.  We believe my uncle had psp also   He recently passed away ,  I want to give my dad the best treatment available","What is the most effective course of action for my Dad, who we suspect has PSP, and how can we find the top doctors to treat this condition?","My Dad is likely suffering from PSP - what are the best steps to take, and who are the leading medical professionals to consult for his treatment?","We're convinced my Dad has PSP - what's the optimal approach to managing his condition, and which doctors are most experienced in treating this disease?","How can I ensure my Dad receives the best possible care for his suspected PSP, and who are the top specialists in this field?","What are the most effective ways to support my Dad, who we believe has PSP, and how can we find the most skilled doctors to help him?"
Q235,"Can a birth control called Ocella cause DVT?  My daughter experiences pains cramping,redness and swelling in her thigh and also really bad huge blood clots during her menstrual cycles after she was prescribed Osella for birth control. Also these symptoms worsened after she gave birth. This has been happening for a year now should she see discuss this with her doctor right away?","Is it possible for the birth control Ocella to cause DVT, considering my daughter's symptoms of thigh pain, cramping, redness, and swelling, as well as large blood clots during her menstrual cycles?","Does the birth control pill Ocella have a risk of causing DVT, given that my daughter has been experiencing severe thigh pain, cramping, redness, and swelling, along with large blood clots during her periods?","Can the use of Ocella for birth control increase the risk of developing DVT, as evidenced by my daughter's symptoms of thigh pain, cramping, redness, and swelling, as well as large blood clots during her menstrual cycles?","Should my daughter discuss her symptoms of thigh pain, cramping, redness, and swelling, as well as large blood clots during her menstrual cycles, with her doctor immediately, given that she's been taking Ocella for birth control?","Is there a link between the birth control Ocella and the development of DVT, considering my daughter's experiences with thigh pain, cramping, redness, and swelling, as well as large blood clots during her periods, which worsened after childbirth?"
Q236,"If a person is not got any seizure attack for five years from last episode, it will be treated as cured or otherwise. kindly let me know after how many days/years it will be treated as cured.",How long does a person need to be seizure-free to be considered cured?,After what period of time without seizure attacks is a person considered cured?,What is the duration of seizure-free period required to declare a person cured?,Can you tell me how many years or days a person needs to be seizure-free to be treated as cured?,"At what point in time, measured in years or days, is a person considered cured if they have not had a seizure attack?"
Q237,My father is suffering from IBS and is losing weight day by day.sometimes he even faints due to weakness.He cannot digest food .please help us and suggest us upon this problem.,"My dad has IBS and is experiencing significant weight loss daily, often feeling faint due to weakness, and struggling to digest food - what can we do to help him?","I'm concerned about my father's health as he's suffering from IBS, losing weight rapidly, and occasionally fainting from weakness - can you offer some guidance on how to address this issue?","My father is battling IBS, which is causing him to lose weight daily and sometimes even faint from weakness - what steps can we take to help him regain his strength and improve digestion?","We're worried about my dad's health as he's dealing with IBS, weight loss, and frequent fainting spells due to weakness - can you provide some advice on how to tackle this problem?","My father has been diagnosed with IBS and is struggling with weight loss, weakness, and difficulty digesting food - what would you recommend to help him overcome these challenges?"
Q238,"I have an aneurysm (2.6cm)for the last 5yrs,last checked about a year ago.experiencing  pain,tighting in abdomen  and chest.should I be going to er.","I've had an aneurysm (2.6cm) for five years, and it was last checked about a year ago; I'm experiencing abdominal and chest pain, as well as tightness - should I visit the emergency room?","For the past five years, I've been living with an aneurysm (2.6cm), which was last evaluated a year ago; currently, I'm dealing with chest and abdominal pain, accompanied by tightness - should I head to the ER?","I've been diagnosed with an aneurysm (2.6cm) five years ago, and it was reassessed about a year ago; lately, I've been experiencing tightness in my abdomen and chest, along with pain - is a trip to the emergency room necessary?","Having lived with an aneurysm (2.6cm) for five years, with the last check-up being a year ago, I'm now experiencing pain and tightness in my abdomen and chest - should I seek emergency medical attention?","With an aneurysm (2.6cm) that's been present for five years, and a check-up a year ago, I'm currently dealing with abdominal and chest pain, as well as tightness - is it time to visit the emergency room?"
Q239,I have a knot about the size of a BB in my right forearm about 2-3 inches from my elbow. It's been there for about 5 years and hurts sometimes. Mostly only notice it when i put pressure on it. You can't see it but can feel it pretty good. It will move about a cm in any direction. I went to the doctors about 4 years ago to have it looked at but they did no xray and said its prob a BB from when i was younger. It's starting to hurt more now without me putting pressure on it so i'm thinking i need to have something done about it. Any ideas on what it could be or what i should do about it?,"I've had a small, BB-sized knot in my right forearm, about 2-3 inches from my elbow, for around 5 years, which occasionally hurts, especially when I apply pressure; what could it be?","For the past 5 years, I've had a small, BB-sized lump in my right forearm, about 2-3 inches from my elbow, that sometimes hurts, particularly when I press on it; can you help me figure out what it might be?","I've been experiencing a small, BB-sized knot in my right forearm, about 2-3 inches from my elbow, for approximately 5 years, which is sometimes painful, especially when I put pressure on it; do you have any ideas what it could be?","I've had a small, BB-sized lump in my right forearm, about 2-3 inches from my elbow, for around 5 years, which occasionally hurts, especially when I apply pressure; what do you think it might be?","For about 5 years, I've had a small, BB-sized knot in my right forearm, about 2-3 inches from my elbow, that sometimes hurts, even without pressure; can you help me determine what it might be and what I should do about it?"
Q240,how to reduced hypertension,What are some ways to lower blood pressure?,How can hypertension be reduced?,What methods can help alleviate hypertension?,Are there any effective ways to reduce hypertension?,What steps can be taken to lower high blood pressure?
Q241,period rashes proceed to vaginal itching. then it develop fungal infection with thick white discharge. i then take flucanazole (antifungal)which cure it. but m worried of taking allopathic medicines. pls tell me what primitive or traditional methods do i use to avoid it. i also have a sensitive skin.,"I've been experiencing period rashes that lead to vaginal itching, followed by a fungal infection with thick white discharge, which I've been treating with flucanazole. However, I'm concerned about relying on allopathic medicines and would like to know about alternative methods to prevent this issue.","After getting period rashes, I typically develop vaginal itching, which progresses to a fungal infection with thick white discharge, and I've been using flucanazole to treat it. Since I'm worried about taking allopathic medicines, can you suggest some traditional or primitive methods to avoid this problem?","I've noticed that I get period rashes, which then cause vaginal itching, and eventually lead to a fungal infection with thick white discharge. I've been taking flucanazole to cure it, but I'm concerned about the long-term effects of allopathic medicines. Are there any natural or traditional remedies that I can use to prevent this issue?","I experience period rashes, followed by vaginal itching, and then a fungal infection with thick white discharge, which I treat with flucanazole. However, I'm anxious about taking allopathic medicines regularly and would like to know about primitive or traditional methods to avoid this problem, considering I have sensitive skin.","What natural or traditional methods can I use to prevent period rashes that lead to vaginal itching and eventually a fungal infection with thick white discharge, instead of relying on flucanazole, which I've been using to treat the issue, especially since I have sensitive skin and concerns about allopathic medicines?"
Q242,She cries in pain and can't sleep at night do to this I believe it's the most common based on age because she wasn't born with it and I just wanna know how I should go about it  she's been to a doctor but they say with the surgery there's only a 50/50 chance of survival that's just what she told me but I really wish there's something I can do to help or something we can prevent the pain any type of help would be termendusly appreciated! She has had it for a whole now maybe a few months or so and she says the pain is increase wich is why I worry.,"My friend has been experiencing severe pain and insomnia, and I think it's the most common condition for her age group since it wasn't present at birth; how can I help her address this issue?","A loved one is suffering from intense pain and sleepless nights, and I believe it's a common affliction for her age group that developed over time; what steps can I take to support her?","Someone close to me is enduring excruciating pain and struggling to sleep due to a condition that wasn't present at birth, and I suspect it's quite common among people her age; how can I assist her in finding relief?","I have a friend who's been dealing with agonizing pain and sleep disturbances, and I think it's a prevalent issue for her age group that arose later in life; what can I do to help her alleviate her suffering?","A person I care about is battling severe pain and insomnia, and I believe it's a common condition that affects people in her age group who didn't have it at birth; how can I help her find a way to manage her pain and improve her quality of life?"
Q243,How helpful is radiation for melanoma of heel and spread all the way up the leg? Would this effect treatment of trial drugs or other treatments?,"What role does radiation play in treating melanoma that has spread from the heel up the leg, and how might this impact the effectiveness of trial drugs or other therapies?","Can radiation be an effective treatment for melanoma that has progressed from the heel to the leg, and would this influence the outcome of clinical trials or alternative treatments?","How does radiation therapy contribute to the management of melanoma that has spread from the heel up the leg, and might this affect the success of experimental medications or other interventions?","Is radiation a valuable tool in combating melanoma that has advanced from the heel to the leg, and could this impact the efficacy of novel treatments or investigational therapies?","What is the therapeutic value of radiation in addressing melanoma that has progressed from the heel up the leg, and how might this influence the treatment approach with emerging drugs or alternative therapies?"
Q244,"My provider can't help (I asked.) I am intolerant of all the sugar alcohols such as maltilol, sorbitol, xylitol, etc. and need something for dry mouth caused by med which I have to take.  Biotene products help for only about two minutes.","I'm experiencing dry mouth due to medication and I'm intolerant to sugar alcohols like maltilol, sorbitol, and xylitol - what can I use to help?","I have to take a medication that causes dry mouth, but I'm allergic to sugar alcohols like maltilol, sorbitol, and xylitol - are there any alternative products that can help?","I'm looking for a solution to dry mouth caused by a medication I'm taking, but I react poorly to sugar alcohols such as maltilol, sorbitol, and xylitol - what are my options?","I'm struggling with dry mouth as a side effect of my medication, and I'm sensitive to sugar alcohols like maltilol, sorbitol, and xylitol - can you recommend a product that might help?","I need a solution for dry mouth caused by a medication, but I'm intolerant to sugar alcohols like maltilol, sorbitol, and xylitol - what can I use instead of Biotene products, which only provide temporary relief?"
Q245,Dear sir/ madam. I am a patient suffering from Friedreich's ataxia and i heard there was a medicine for it. In 2009 and since we are looking for the medicine kindly help on this and I have DNA report could You please help us on this as there are two people respective age 22 years and 24 years suffering from it. Looking for your help on this ASAP and please let us know when the medicine will be there in market and attaching two files for your reference,"I am reaching out as a patient with Friedreich's ataxia, and I've heard that there may be a treatment available. Could you please assist me in finding this medicine, especially since 2009? I have a DNA report and would appreciate your help, as two individuals, aged 22 and 24, are suffering from this condition.","I am a patient diagnosed with Friedreich's ataxia and I've come across information about a potential medicine. Since 2009, I've been searching for this treatment and would be grateful if you could provide guidance. I've attached two files for your reference, and I'm seeking help for two individuals, aged 22 and 24, who are affected by this condition.","As a patient living with Friedreich's ataxia, I've learned about a possible medication for the condition. I'm reaching out for assistance in finding this treatment, which I've been searching for since 2009. I've included a DNA report and would appreciate your help in finding a solution for the two individuals, aged 22 and 24, who are suffering from Friedreich's ataxia.","I'm writing to inquire about a potential medicine for Friedreich's ataxia, a condition I've been diagnosed with. Since 2009, I've been searching for a treatment and would be grateful if you could provide guidance. I've attached two files for your reference, and I'm seeking help for two individuals, aged 22 and 24, who are affected by this condition.","I'm a patient with Friedreich's ataxia and I've heard rumors of a medicine being developed. Could you please help me find this treatment, which I've been searching for since 2009? I've included a DNA report and would appreciate your assistance in finding a solution for the two individuals, aged 22 and 24, who are suffering from this condition."
Q246,"Hello Dr.,In a case of patient with Kidney Stone size of 1.2mm x 2.3mm. What can i do? Pls i need your advice.","Doctor, I have a patient with a kidney stone measuring 1.2mm x 2.3mm - what's the best course of action?",I'm dealing with a patient who has a kidney stone that's 1.2mm x 2.3mm in size - can you offer some guidance?,A patient of mine has a kidney stone that measures 1.2mm x 2.3mm - what would you recommend in this situation?,I need your expert advice on a patient with a kidney stone sized 1.2mm x 2.3mm - what should I do?,What's the recommended treatment for a patient with a kidney stone that's 1.2mm x 2.3mm in size?
Q247,I have had renal organ transplant surgery a year ago. What risk factos must I avoid to prevent the recurrance of ESRD and to maintain a healthy functioning grafted kidney ?,What risk factors should I avoid to prevent ESRD recurrence and maintain a healthy grafted kidney after a year of renal organ transplant surgery?,"A year after renal organ transplant surgery, what risk factors must I steer clear of to prevent ESRD recurrence and ensure my grafted kidney remains healthy?","Following renal organ transplant surgery a year ago, what risk factors do I need to avoid to prevent the recurrence of ESRD and maintain optimal grafted kidney function?","What risk factors must I mitigate to prevent ESRD recurrence and maintain a healthy grafted kidney, considering I had renal organ transplant surgery a year ago?","After undergoing renal organ transplant surgery a year ago, what risk factors should I be aware of to prevent ESRD recurrence and promote a healthy functioning grafted kidney?"
Q248,"My question is.what is the treatment  for chronic gonorrhea, massive growth?",What is the recommended treatment for chronic gonorrhea with massive growth?,How is chronic gonorrhea with massive growth typically treated?,What are the treatment options for chronic gonorrhea when there is massive growth?,Can you tell me the best approach to treating chronic gonorrhea with massive growth?,What is the most effective way to treat chronic gonorrhea when it involves massive growth?
